{
  "_schema": "fitshield-android-apps/1",
  "_note": "PORTED from blocklists/delivery.json by tools/port-android-apps.js (additive; the blocklist stays authoritative). One entry per brand; brandId is the brand's canonical domain and all display metadata is generated from the blocklists. Confirmed packageIds are preserved on re-run; unknown ones stay needs_review — never guess a package ID.",
  "defaultCategory": "delivery",
  "apps": [
    {"brandId":"2berega.ru","packageIds":["ru.dvaberega"]},
    {"brandId":"58.com","packageIds":[],"packageStatus":"needs_review"},
    {"brandId":"58daojia.com","packageIds":[],"packageStatus":"needs_review"},
    {"brandId":"60chicken.com","packageIds":["com.jangs.sixtychicken"]},
    {"brandId":"99food.com.br","packageIds":["com.xiaojukeji.didi.brazil.customer"]},
    {"brandId":"abaty.com","packageIds":[],"packageStatus":"needs_review"},
    {"brandId":"africabites.com","packageIds":[],"packageStatus":"needs_review"},
    {"brandId":"afrimarket.fr","packageIds":[],"packageStatus":"needs_review"},
    {"brandId":"ahodrink.com","packageIds":[],"packageStatus":"needs_review"},
    {"brandId":"aiqfome.com","packageIds":["com.vanuatu.aiqfome"]},
    {"brandId":"aiqfome.com.br","packageIds":[],"packageStatus":"needs_review"},
    {"brandId":"airasiafood.com","packageIds":[],"packageStatus":"needs_review"},
    {"brandId":"akhbarelyomfood.com","packageIds":[],"packageStatus":"needs_review"},
    {"brandId":"akiyab.com","packageIds":[],"packageStatus":"needs_review"},
    {"brandId":"aklyakl.com","packageIds":[],"packageStatus":"needs_review"},
    {"brandId":"allsetnow.com","packageIds":["com.allset.client"]},
    {"brandId":"ambassador.ai","packageIds":[],"packageStatus":"needs_review"},
    {"brandId":"angelinus.com","packageIds":[],"packageStatus":"needs_review"},
    {"brandId":"anota.ai","packageIds":[],"packageStatus":"needs_review"},
    {"brandId":"appetito24.com","packageIds":["com.mobmedianet.appetito24"]},
    {"brandId":"appetito24.com.do","packageIds":[],"packageStatus":"needs_review"},
    {"brandId":"appetito24.com.pa","packageIds":[],"packageStatus":"needs_review"},
    {"brandId":"arbuz.kz","packageIds":["kz.arbuz.arbuzkz"]},
    {"brandId":"asap.com","packageIds":[],"packageStatus":"needs_review"},
    {"brandId":"asap.com.jm","packageIds":[],"packageStatus":"needs_review"},
    {"brandId":"asapdelivery.com","packageIds":[],"packageStatus":"needs_review"},
    {"brandId":"asapdelivery.com.tt","packageIds":[],"packageStatus":"needs_review"},
    {"brandId":"ashley.co.kr","packageIds":["com.elandeats.crm"]},
    {"brandId":"baemin.co.kr","packageIds":["com.sampleapp"]},
    {"brandId":"baemin.com","packageIds":[],"packageStatus":"needs_review"},
    {"brandId":"baemin.me","packageIds":[],"packageStatus":"needs_review"},
    {"brandId":"baemin.vn","packageIds":[],"packageStatus":"needs_review"},
    {"brandId":"baiduwaimai.com","packageIds":[],"packageStatus":"needs_review"},
    {"brandId":"bajfood.com","packageIds":[],"packageStatus":"needs_review"},
    {"brandId":"bargainbox.co.nz","packageIds":[],"packageStatus":"needs_review"},
    {"brandId":"basefood.co.jp","packageIds":["com.commmune.basefoodlabo"]},
    {"brandId":"baskinrobbins.co.kr","packageIds":["kr.co.baskinrobbins.client"]},
    {"brandId":"bbq.co.kr","packageIds":["kr.co.genesiskorea.bbqchicken"]},
    {"brandId":"beepit.com.ph","packageIds":["com.storehub.beep"]},
    {"brandId":"befood.vn","packageIds":[],"packageStatus":"needs_review"},
    {"brandId":"behrouzbiryani.com","packageIds":["com.behrouzbiryani"]},
    {"brandId":"best-inc.com","packageIds":[],"packageStatus":"needs_review"},
    {"brandId":"beyondmenu.com","packageIds":["com.beyondmenu"]},
    {"brandId":"bhc.co.kr","packageIds":["com.foodtechkorea.bhc"]},
    {"brandId":"bitesquad.com","packageIds":["com.kasacapital.bitesquad"]},
    {"brandId":"bolt.eu","packageIds":["ee.mtakso.client"]},
    {"brandId":"boltfood.com","packageIds":["com.bolt.deliveryclient"]},
    {"brandId":"boltfood.cz","packageIds":[],"packageStatus":"needs_review"},
    {"brandId":"boltfood.ee","packageIds":[],"packageStatus":"needs_review"},
    {"brandId":"boltfood.fi","packageIds":[],"packageStatus":"needs_review"},
    {"brandId":"boltfood.gh","packageIds":[],"packageStatus":"needs_review"},
    {"brandId":"boltfood.hr","packageIds":[],"packageStatus":"needs_review"},
    {"brandId":"boltfood.hu","packageIds":[],"packageStatus":"needs_review"},
    {"brandId":"boltfood.lt","packageIds":[],"packageStatus":"needs_review"},
    {"brandId":"boltfood.lv","packageIds":[],"packageStatus":"needs_review"},
    {"brandId":"boltfood.ng","packageIds":[],"packageStatus":"needs_review"},
    {"brandId":"boltfood.pl","packageIds":[],"packageStatus":"needs_review"},
    {"brandId":"boltfood.pt","packageIds":[],"packageStatus":"needs_review"},
    {"brandId":"boltfood.ro","packageIds":[],"packageStatus":"needs_review"},
    {"brandId":"boltfood.si","packageIds":[],"packageStatus":"needs_review"},
    {"brandId":"boltfood.sk","packageIds":[],"packageStatus":"needs_review"},
    {"brandId":"bonchon.com","packageIds":[],"packageStatus":"needs_review"},
    {"brandId":"bornga.co.kr","packageIds":[],"packageStatus":"needs_review"},
    {"brandId":"bottlesapp.co.za","packageIds":["com.bottles"]},
    {"brandId":"box8.in","packageIds":["com.poncho"]},
    {"brandId":"bringo.uz","packageIds":["uz.bringo"]},
    {"brandId":"broniboy.ru","packageIds":["com.broniboy.client"]},
    {"brandId":"burgerking.co.kr","packageIds":["kr.co.burgerkinghybrid"]},
    {"brandId":"burgerking.com.cn","packageIds":[],"packageStatus":"needs_review"},
    {"brandId":"cainiao.com","packageIds":[],"packageStatus":"needs_review"},
    {"brandId":"cainiao.com.cn","packageIds":[],"packageStatus":"needs_review"},
    {"brandId":"capichiapp.com","packageIds":["com.capichi.order"]},
    {"brandId":"careem.com","packageIds":["com.careem.acma"]},
    {"brandId":"careemfood.com","packageIds":[],"packageStatus":"needs_review"},
    {"brandId":"carriage.com.my","packageIds":[],"packageStatus":"needs_review"},
    {"brandId":"catchtable.co.kr","packageIds":["co.kr.catchtable.android.catchtable_app"]},
    {"brandId":"caviar.com","packageIds":["com.trycaviar.customer"]},
    {"brandId":"chagee.com","packageIds":[],"packageStatus":"needs_review"},
    {"brandId":"checkers60.com","packageIds":["za.co.shoprite.sixty60"]},
    {"brandId":"chefgood.com.au","packageIds":[],"packageStatus":"needs_review"},
    {"brandId":"cheogajip.co.kr","packageIds":["com.wmpoplus.cheogajip"]},
    {"brandId":"chibbis.ru","packageIds":["ru.chibbis"]},
    {"brandId":"chickenplus.co.kr","packageIds":["com.wmpoplus.chickenplus"]},
    {"brandId":"chocofood.kz","packageIds":["kz.chocofood.chocofoodapp"]},
    {"brandId":"chope.co","packageIds":["com.chope.gui"]},
    {"brandId":"chowcentral.com","packageIds":["com.chowcentral"]},
    {"brandId":"chowdeck.com","packageIds":["com.chowdeck.com"]},
    {"brandId":"chownow.com","packageIds":["com.chownow.discover"]},
    {"brandId":"clickandfood.fr","packageIds":[],"packageStatus":"needs_review"},
    {"brandId":"clustertruck.com","packageIds":["com.clustertruck.consumer"]},
    {"brandId":"co-opdeli.jp","packageIds":["jp.coopdeli.coopdeliapp"]},
    {"brandId":"coffeebeankorea.com","packageIds":["com.coffeebeankorea.purpleorder"]},
    {"brandId":"composecoffee.com","packageIds":["ci.dvn.composecoffee.app"]},
    {"brandId":"cookpad.com.cn","packageIds":[],"packageStatus":"needs_review"},
    {"brandId":"cotticoffee.com","packageIds":[],"packageStatus":"needs_review"},
    {"brandId":"coupang.com","packageIds":[],"packageStatus":"needs_review"},
    {"brandId":"coupangeats.com","packageIds":["com.coupang.mobile.eats"]},
    {"brandId":"dada.cn","packageIds":[],"packageStatus":"needs_review"},
    {"brandId":"dadajiasong.com","packageIds":[],"packageStatus":"needs_review"},
    {"brandId":"daichi-m.co.jp","packageIds":["li.yapp.appA46A899B"]},
    {"brandId":"danggeunmarket.com","packageIds":["com.towneers.www"]},
    {"brandId":"daojia.com","packageIds":[],"packageStatus":"needs_review"},
    {"brandId":"daojia.jd.com","packageIds":[],"packageStatus":"needs_review"},
    {"brandId":"dashdelivery.co.za","packageIds":["com.dashdelivery"]},
    {"brandId":"ddangddang.co.kr","packageIds":["com.appg.codd.user"]},
    {"brandId":"ddangyo.com","packageIds":["com.shinhan.o2o"]},
    {"brandId":"delivereasy.co.nz","packageIds":["nz.co.delivereasy"]},
    {"brandId":"deliveroo.ae","packageIds":[],"packageStatus":"needs_review"},
    {"brandId":"deliveroo.be","packageIds":[],"packageStatus":"needs_review"},
    {"brandId":"deliveroo.co.uk","packageIds":["com.deliveroo.orderapp"]},
    {"brandId":"deliveroo.com.sg","packageIds":[],"packageStatus":"needs_review"},
    {"brandId":"deliveroo.es","packageIds":[],"packageStatus":"needs_review"},
    {"brandId":"deliveroo.fr","packageIds":[],"packageStatus":"needs_review"},
    {"brandId":"deliveroo.hk","packageIds":[],"packageStatus":"needs_review"},
    {"brandId":"deliveroo.ie","packageIds":[],"packageStatus":"needs_review"},
    {"brandId":"deliveroo.it","packageIds":[],"packageStatus":"needs_review"},
    {"brandId":"delivery-club.ru","packageIds":[],"packageStatus":"needs_review"},
    {"brandId":"delivery.com","packageIds":["com.deliverycom"]},
    {"brandId":"deliverydireto.com.br","packageIds":["com.delivery.direto"]},
    {"brandId":"deliverydudes.com","packageIds":["biz.deliverydudes.customerapp"]},
    {"brandId":"deliveryk.com","packageIds":["com.teamjin.deliveryk"]},
    {"brandId":"deliverymuch.com.br","packageIds":["br.com.deliverymuch.gastro"]},
    {"brandId":"deliveryvip.com.br","packageIds":[],"packageStatus":"needs_review"},
    {"brandId":"delivroum.com","packageIds":[],"packageStatus":"needs_review"},
    {"brandId":"demae-can.com","packageIds":["com.demaecan.androidapp"]},